context,question,answer
Fees and Charges,What are the fees associated with the HDFC Infinia Credit Card?,"The HDFC Infinia Credit Card has an annual fee of INR 10,000 plus taxes, which may be waived upon reaching a specified spend threshold."
Fees and Charges,Are there any late payment charges on the HDFC Infinia Credit Card?,
Fees and Charges,What are the finance charges on the HDFC Infinia Credit Card?,
Fees and Charges,What are the charges for foreign currency transactions on the HDFC Infinia Credit Card?,The foreign currency transaction fee is typically 2% of the transaction amount.
Fees and Charges,Are there any penalties for late payments on the HDFC Infinia Credit Card?,"Yes, there are penalties for late payments, which include a late payment fee and increased interest charges."
Fees and Charges,How are interest charges calculated on the HDFC Infinia Credit Card?,Interest charges are calculated based on the average daily balance method.
